{
  "week_start": "2026-07-06",
  "generated_at": "2026-07-12T21:15:00-04:00",
  "headline": "GPT-5.6 clears its government-approval gate and goes global, but the real change is OpenAI's three-tier cost structure replacing single-flagship pricing as the new competitive template.",
  "themes": [
    {
      "theme_id": "government-gated-frontier-access",
      "headline": "GPT-5.6 clears the last government-approval gate, closing out the access-tiering saga that dominated the prior two weeks",
      "summary": "GPT-5.6 moved from a preview restricted to roughly 20 Commerce-Department-approved organizations to full global general availability on July 9, after the US lifted the access restrictions around July 8. This resolves the two-tier standoff that defined the prior two weeks, where Anthropic's models were restored globally while OpenAI's flagship stayed capped. With both labs now open, government-approval-list gating is no longer the active constraint; the competitive axis shifts to how each lab prices and segments access.",
      "implication": "Stop planning around approval-list access as a near-term constraint; redirect that planning effort to the tiered-pricing and passkey-provisioning requirements that replaced it.",
      "citations": [
        {
          "tab_id": "research",
          "item_id": "openai-gpt-5-6-global-ga-july9",
          "label": "OpenAI's GPT-5.6 model card confirms global GA after US lifts export-style restrictions",
          "primary_url": "https://openai.com/index/gpt-5-6/"
        },
        {
          "tab_id": "launches",
          "item_id": "gpt-5-6-ga-launch",
          "label": "Launches tab logs GPT-5.6 GA as the week's top-scored item",
          "primary_url": "https://openai.com/index/gpt-5-6/"
        },
        {
          "tab_id": "x",
          "item_id": "x-openai-gpt56-ga-launch",
          "label": "Sam Altman's GA announcement is the week's top X item",
          "primary_url": "https://x.com/sama/status/2074709023807664454"
        },
        {
          "tab_id": "reddit",
          "item_id": "openai-gpt56-sol-public-ga-rollout-chaos-2026-07-09",
          "label": "r/OpenAI thread on the public GA rollout flags a METR reward-hacking concern alongside the launch",
          "primary_url": "https://www.reddit.com/r/OpenAI/comments/1usoe1c/gpt56_sol_is_the_real_deal/"
        }
      ],
      "recurrence": {
        "status": "fading",
        "weeks_count": 3,
        "first_seen_week": "2026-06-22",
        "note": "Citation volume held around 6 for two weeks while the gate was in place; this week the underlying constraint resolved (GA for the last capped lab), so the story is closing out rather than intensifying further. Expect this theme to drop next week unless a new gating dispute emerges."
      },
      "tags": ["export-controls", "frontier-access", "openai", "governance"]
    },
    {
      "theme_id": "frontier-model-cost-tiering-as-control-lever",
      "headline": "GPT-5.6's Sol/Terra/Luna pricing turns model selection into a deliberate cost-and-risk-control decision, not just a capability upgrade",
      "summary": "GPT-5.6 ships in three priced tiers (Sol $5/$30, Terra $2.50/$15, Luna $1/$6 per million tokens) explicitly designed to let teams route work by capability need rather than defaulting to the flagship, and the most cyber-capable tier will require hardware passkeys by September 1, 2026. Coverage across video breakdowns and OpenAI's own launch materials treats the tiering as the operative story, more than the benchmark gains themselves (ExploitBench moved from 47.9% to 73.5%).",
      "implication": "Run a workload-to-tier mapping now: high-volume drafting and retrieval belongs on Luna or Terra, Sol only for coding-agent or high-stakes reasoning tasks, and confirm whether current API provisioning supports per-user hardware passkeys before the September 1 deadline breaks shared-account access.",
      "citations": [
        {
          "tab_id": "research",
          "item_id": "openai-gpt-5-6-global-ga-july9",
          "label": "Research tab's enterprise_adaptation section frames the tier map as a direct cost-control lever, with a named passkey-provisioning caveat",
          "primary_url": "https://openai.com/index/gpt-5-6/"
        },
        {
          "tab_id": "youtube",
          "item_id": "ai-labs-gpt56-sol-seven-rules-codex",
          "label": "AI Labs walkthrough treats tier selection as the practical workflow decision for Codex users",
          "primary_url": "https://www.youtube.com/watch?v=STczJBYJf7w"
        },
        {
          "tab_id": "youtube",
          "item_id": "matthew-berman-gpt56-sol-launch-review",
          "label": "Matthew Berman's launch review covers the tier pricing structure directly",
          "primary_url": "https://www.youtube.com/watch?v=roGmNXASYOM"
        }
      ],
      "recurrence": {
        "status": "new",
        "weeks_count": 1
      },
      "tags": ["pricing", "tiered-deployment", "cost-control", "openai", "cybersecurity"]
    },
    {
      "theme_id": "vendor-benchmark-trust-erosion",
      "headline": "Musk's 'Opus-class' Grok 4.5 claim is contradicted by Artificial Analysis; Reddit separately flags cherry-picked GPT-5.6 benchmarks",
      "summary": "Elon Musk's public launch claim that Grok 4.5 is 'Opus-class' was directly disputed by Artificial Analysis's independent benchmark thread the same week, reigniting the same pattern flagged last week with unverified Grok and Meta capability claims. In parallel, r/singularity accused OpenAI of publishing selective GPT-5.6 benchmarks, and a LinkedIn critique from an independent reviewer argued Grok 4.5 shows hallucination issues its launch benchmarks don't surface.",
      "implication": "Continue gating any capability comparison used for procurement on independently reproduced benchmarks (Artificial Analysis or equivalent), not vendor launch claims or executive statements on social media.",
      "citations": [
        {
          "tab_id": "x",
          "item_id": "x-artificialanlys-grok45-benchmark-thread",
          "label": "Artificial Analysis benchmark thread contradicts Musk's 'Opus-class' framing for Grok 4.5",
          "primary_url": "https://x.com/ArtificialAnlys/status/2074956932289282087"
        },
        {
          "tab_id": "x",
          "item_id": "x-debate-opus-class-framing",
          "label": "X hot-take thread debates the 'Opus-class' framing directly",
          "primary_url": "https://x.com/elonmusk/status/2074740539874775163"
        },
        {
          "tab_id": "reddit",
          "item_id": "singularity-gpt56-sol-benchmarks-selective-2026-07-09",
          "label": "r/singularity thread accuses OpenAI of selective GPT-5.6 benchmark reporting",
          "primary_url": "https://www.reddit.com/r/singularity/comments/1urx260/gpt_56_sol_benchmarks/"
        },
        {
          "tab_id": "social",
          "item_id": "tp-victor-sankin-grok-critique",
          "label": "Victor Sankin's LinkedIn critique argues Grok 4.5's launch benchmarks mask hallucination issues",
          "primary_url": "https://www.linkedin.com/posts/victor-sankin-89377b7a_grok-45-is-the-comeback-of-the-year-or-activity-7481265657410596864-mulW"
        }
      ],
      "recurrence": {
        "status": "returning",
        "weeks_count": 2,
        "first_seen_week": "2026-06-29",
        "note": "Same failure pattern as last week's Sonnet 5 benchmark-graph and unverified-claims episode, now recurring with a different lab (xAI/Grok) and a different independent verifier (Artificial Analysis) doing the contradicting."
      },
      "tags": ["benchmarks", "trust", "evaluation", "xai", "openai"]
    },
    {
      "theme_id": "agentic-cost-and-usage-backlash",
      "headline": "Cost governance shifts from complaint to countermeasure: a $200-in-20-minutes burn story runs alongside a 95%-token-reduction workaround",
      "summary": "Practitioners continue reporting uncontrolled token burn — one Reddit thread describes a Claude subagent workflow burning $200 in 20 minutes — but this week's coverage pairs that with active mitigation: a 'just say done' prompting pattern claiming up to 95% output-token reduction, and Anthropic flipping Claude Enterprise's individual usage analytics to on-by-default on July 11 for all tenants. The pattern has moved from pure backlash toward tooling and defaults that make cost visible before it becomes a surprise.",
      "implication": "Treat the July 11 Claude Enterprise analytics default change as a trigger to audit visibility settings now, and pilot output-token-reduction prompting patterns on the highest-volume agentic workflows before the next budget cycle.",
      "citations": [
        {
          "tab_id": "reddit",
          "item_id": "claudeai-fable-subagent-burns-200-in-20-minutes-2026-07-07",
          "label": "r/ClaudeAI: subagent workflow burns $200 in 20 minutes",
          "primary_url": "https://www.reddit.com/r/ClaudeAI/comments/1uphiwz/rip/"
        },
        {
          "tab_id": "reddit",
          "item_id": "claudecode-justsaydone-token-reduction-workflow-2026-07-06",
          "label": "r/ClaudeCode: 'just say done' workflow claims up to 95% output-token reduction",
          "primary_url": "https://www.reddit.com/r/ClaudeCode/comments/1up1myd/cut_claude_code_output_token_usage_up_to_95_just/"
        },
        {
          "tab_id": "launches",
          "item_id": "claude-enterprise-analytics-default-change",
          "label": "Claude Enterprise individual usage analytics switches to on-by-default July 11",
          "primary_url": "https://www.anthropic.com/news"
        }
      ],
      "recurrence": {
        "status": "returning",
        "weeks_count": 9,
        "first_seen_week": "2026-05-11",